<!ELEMENT armi (arma+)> 
<!ELEMENT arma (nome?, descrizione?)> 
<!ELEMENT nome (#PCDATA)> 
<!ELEMENT descrizione (#PCDATA)> 

<!ATTLIST arma tipo CDATA #REQUIRED> 
